<?xml version="1.0" encoding="UTF-8"?>
<Header xmlns:xsi="http://www.w3.org/2001/XMLSchema-instance" Version="5.0" xsi:noNamespaceSchemaLocation="LeistungsschnittstelleV50.xsd">
	<ReceivingApplication>TARDOC Test</ReceivingApplication>
	<ReceivingFacility>1234</ReceivingFacility>
	<ReceivingServiceCode>Radiologie</ReceivingServiceCode>
	<SendingApplication>ALIS</SendingApplication>
	<SendingFacility>4321</SendingFacility>
	<SendingServiceCode>4321</SendingServiceCode>
	<MessageControlID>1262557</MessageControlID>
	<SoftwareReleaseNumber>1.1.0</SoftwareReleaseNumber>
	<FileCreationDate>2024-04-05T10:06:44Z</FileCreationDate>
	<Visit>
		<VisitNumber>987654</VisitNumber>
		<PatientID>102</PatientID>
		<PatientName>Tester</PatientName>
		<PatientGivenName>Paul</PatientGivenName>
		<PatientBirthDate>1982-03-22</PatientBirthDate>
		<PatientGender>M</PatientGender>
		<Service Transaction="insert">
			<ServiceDate>2024-04-04T09:00:00Z</ServiceDate>
			<SessionID>1</SessionID>
			<OrderID>20240405-1</OrderID>
			<ReferrerID>007</ReferrerID>
			<ProviderID>2400</ProviderID>
			<EnteredBy>7653253256988</EnteredBy>
			<PatientContactID>20230404-1</PatientContactID>
			<Diagnosis>
				<Identifier>DIAG1</Identifier>
				<Category>ICD10_2023</Category>
				<Code>B01.2</Code>
				<Display>Varizellen-Pneumonie</Display>
				<Laterality>l</Laterality>
			</Diagnosis>
			<Procedure>
				<Identifier>PROC1</Identifier>
				<Category>CHOP_2023</Category>
				<Code>87.41.99</Code>
				<Display>Computertomographie des Thorax, sonstige</Display>
				<OccurrenceDateTime>2024-04-04T10:06:50Z</OccurrenceDateTime>
				<Laterality>l</Laterality>			
				<Performer>
					<Function>ResponsiblePhysician</Function>
					<Identifier>7653253256999</Identifier>
				</Performer>
			</Procedure>
		</Service>
	</Visit>
</Header>