<?xml version="1.0" encoding="UTF-8"?>
<Header xmlns:xsi="http://www.w3.org/2001/XMLSchema-instance" Version="5.0" xsi:noNamespaceSchemaLocation="LeistungsschnittstelleV50.xsd">
	<ReceivingApplication>TARDOCTest</ReceivingApplication>
	<ReceivingFacility>1234</ReceivingFacility>
	<ReceivingServiceCode>Radiologie</ReceivingServiceCode>
	<SendingApplication>ALIS</SendingApplication>
	<SendingFacility>4321</SendingFacility>
	<SendingServiceCode>4321</SendingServiceCode>
	<MessageControlID>1262556</MessageControlID>
	<SoftwareReleaseNumber>1.1.0</SoftwareReleaseNumber>
	<FileCreationDate>2024-04-05T10:06:44Z</FileCreationDate>
	<Visit>
		<VisitNumber>987654</VisitNumber>
		<PatientID>102</PatientID>
		<PatientName>Tester</PatientName>
		<PatientGivenName>Paul</PatientGivenName>
		<PatientBirthDate>1982-03-22</PatientBirthDate>
		<PatientGender>M</PatientGender>
		<Service Transaction="insert">
			<ServiceDate>2024-04-05T09:00:00Z</ServiceDate>
			<SessionID>1</SessionID>
			<OrderID>20240405-1</OrderID>
			<ReferrerID>007</ReferrerID>
			<ServiceType>TARDOC_1.3.2</ServiceType>
			<ServiceItem>MA.00.0040</ServiceItem>
			<EnteredDateTime>2024-04-05T10:05:36Z</EnteredDateTime>
			<ProviderID>2400</ProviderID>
			<EnteredBy>7653253256988</EnteredBy>
			<ItemNumber>45678</ItemNumber>
			<Quantity>1</Quantity>
			<PersonV40 PersonTyp="ResponsiblePhysician">
				<PersonID>7653253256988</PersonID>
			</PersonV40>
			<PersonV40 PersonTyp="ProvidingPhysician">
				<PersonID>7653253256988</PersonID>
			</PersonV40>
		</Service>
		<Service Transaction="insert">
			<ServiceDate>2024-04-05T09:00:00Z</ServiceDate>
			<SessionID>1</SessionID>
			<OrderID>20240405-1</OrderID>
			<ReferrerID>007</ReferrerID>
			<ServiceType>TARDOC_1.3.2</ServiceType>
			<ServiceItem>MA.00.0050</ServiceItem>
			<EnteredDateTime>2024-04-05T10:05:36Z</EnteredDateTime>
			<ProviderID>2400</ProviderID>
			<EnteredBy>7653253256988</EnteredBy>
			<ItemNumber>45679</ItemNumber>
			<RefItemNumber>45678</RefItemNumber>
			<Quantity>1</Quantity>
			<PersonV40 PersonTyp="ResponsiblePhysician">
				<PersonID>7653253256988</PersonID>
			</PersonV40>
			<PersonV40 PersonTyp="ProvidingPhysician">
				<PersonID>7653253256988</PersonID>
			</PersonV40>
		</Service>
	</Visit>
</Header>